{
  "fixture_version": "escopa-fixture/v1",
  "id": "captures/multiple-capture-choices/alternate-set-selection",
  "ruleset": "escopa-2p-v1",
  "description": "A played card can select a different legal capture set in a multi-option table state.",
  "deck_type": "spanish",
  "initial_state": {
    "dealer": 0,
    "next_player": 0,
    "score": {
      "0": 0,
      "1": 0
    },
    "stock_remaining": 24,
    "hands": {
      "0": [
        { "id": "ca0p0h0", "rank": "5", "suit": "OROS" },
        { "id": "ca0p0h1", "rank": "J", "suit": "COPAS" },
        { "id": "ca0p0h2", "rank": "3", "suit": "ESPADAS" }
      ],
      "1": [
        { "id": "ca0p1h0", "rank": "Q", "suit": "BASTOS" },
        { "id": "ca0p1h1", "rank": "2", "suit": "OROS" },
        { "id": "ca0p1h2", "rank": "6", "suit": "COPAS" }
      ]
    },
    "captured": {
      "0": [],
      "1": []
    },
    "table": [
      { "id": "ca0t0", "rank": "Q", "suit": "ESPADAS" },
      { "id": "ca0t1", "rank": "2", "suit": "BASTOS" },
      { "id": "ca0t2", "rank": "4", "suit": "OROS" },
      { "id": "ca0t3", "rank": "7", "suit": "ESPADAS" },
      { "id": "ca0t4", "rank": "A", "suit": "COPAS" }
    ],
    "scopas": {
      "0": 0,
      "1": 0
    },
    "target_score": 15,
    "scoring_suit": "OROS"
  },
  "action": {
    "type": "play_card",
    "player": 0,
    "card_id": "ca0p0h0",
    "captured_card_ids": ["ca0t1", "ca0t3", "ca0t4"]
  },
  "expected": {
    "state": {
      "dealer": 0,
      "next_player": 1,
      "score": {
        "0": 0,
        "1": 0
      },
      "stock_remaining": 24,
      "hands": {
        "0": [
          { "id": "ca0p0h1", "rank": "J", "suit": "COPAS" },
          { "id": "ca0p0h2", "rank": "3", "suit": "ESPADAS" }
        ],
        "1": [
          { "id": "ca0p1h0", "rank": "Q", "suit": "BASTOS" },
          { "id": "ca0p1h1", "rank": "2", "suit": "OROS" },
          { "id": "ca0p1h2", "rank": "6", "suit": "COPAS" }
        ]
      },
      "captured": {
        "0": [
          { "id": "ca0p0h0", "rank": "5", "suit": "OROS" },
          { "id": "ca0t1", "rank": "2", "suit": "BASTOS" },
          { "id": "ca0t3", "rank": "7", "suit": "ESPADAS" },
          { "id": "ca0t4", "rank": "A", "suit": "COPAS" }
        ],
        "1": []
      },
      "table": [
        { "id": "ca0t0", "rank": "Q", "suit": "ESPADAS" },
        { "id": "ca0t2", "rank": "4", "suit": "OROS" }
      ],
      "scopas": {
        "0": 0,
        "1": 0
      },
      "target_score": 15,
      "scoring_suit": "OROS",
      "last_captor": 0
    }
  }
}
