{
  "fixture_version": "escopa-fixture/v1",
  "id": "values/card-values/base-values",
  "ruleset": "escopa-2p-v1",
  "description": "Card value map for A-7,Q,J,K and parity between suits.",
  "deck_type": "spanish",
  "initial_state": {
    "dealer": 0,
    "next_player": 0,
    "score": {
      "0": 0,
      "1": 0
    },
    "stock_remaining": 34,
    "hands": {
      "0": [],
      "1": []
    },
    "captured": {
      "0": [],
      "1": []
    },
    "table": [],
    "scopas": {
      "0": 0,
      "1": 0
    },
    "target_score": 15,
    "scoring_suit": "OROS"
  },
  "action": {
    "type": "assert_deck"
  },
  "expected": {
    "assertions": {
      "card_values": {
        "A": 1,
        "2": 2,
        "3": 3,
        "4": 4,
        "5": 5,
        "6": 6,
        "7": 7,
        "Q": 8,
        "J": 9,
        "K": 10
      },
      "deck_card_count": 40
    },
    "state": {
      "dealer": 0,
      "next_player": 0,
      "score": {
        "0": 0,
        "1": 0
      },
      "stock_remaining": 34,
      "hands": {
        "0": [],
        "1": []
      },
      "captured": {
        "0": [],
        "1": []
      },
      "table": [],
      "scopas": {
        "0": 0,
        "1": 0
      },
      "target_score": 15,
      "scoring_suit": "OROS"
    }
  }
}
