{
  "fixture_version": "escopa-fixture/v1",
  "id": "rounds/end-round/leftover-to-last-captor",
  "ruleset": "escopa-2p-v1",
  "description": "When stock is exhausted and round ends, leftover table cards go to last captor.",
  "deck_type": "spanish",
  "initial_state": {
    "dealer": 0,
    "next_player": 1,
    "score": {
      "0": 2,
      "1": 0
    },
    "stock_remaining": 0,
    "hands": {
      "0": [],
      "1": [
        { "id": "r0p1h0", "rank": "J", "suit": "ESPADAS" }
      ]
    },
    "captured": {
      "0": [
        { "id": "r0c0", "rank": "A", "suit": "OROS" }
      ],
      "1": []
    },
    "table": [
      { "id": "r0t0", "rank": "2", "suit": "COPAS" },
      { "id": "r0t1", "rank": "4", "suit": "ESPADAS" },
      { "id": "r0t2", "rank": "5", "suit": "BASTOS" },
      { "id": "r0t3", "rank": "K", "suit": "OROS" }
    ],
    "scopas": {
      "0": 0,
      "1": 1
    },
    "target_score": 15,
    "scoring_suit": "OROS"
  },
  "action": {
    "type": "play_card",
    "player": 1,
    "card_id": "r0p1h0",
    "captured_card_ids": ["r0t0", "r0t1"]
  },
  "expected": {
    "state": {
      "dealer": 0,
      "next_player": null,
      "score": {
        "0": 2,
        "1": 3
      },
      "stock_remaining": 0,
      "hands": {
        "0": [],
        "1": []
      },
      "captured": {
        "0": [
          { "id": "r0c0", "rank": "A", "suit": "OROS" }
        ],
        "1": [
          { "id": "r0p1h0", "rank": "J", "suit": "ESPADAS" },
          { "id": "r0t0", "rank": "2", "suit": "COPAS" },
          { "id": "r0t1", "rank": "4", "suit": "ESPADAS" },
          { "id": "r0t2", "rank": "5", "suit": "BASTOS" },
          { "id": "r0t3", "rank": "K", "suit": "OROS" }
        ]
      },
      "table": [],
      "scopas": {
        "0": 0,
        "1": 1
      },
      "target_score": 15,
      "scoring_suit": "OROS",
      "last_captor": 1,
      "round_complete": true,
      "round_points": {
        "0": 0,
        "1": 3
      },
      "match_complete": false
    },
    "assertions": {
      "round_end": true,
      "round_points": {
        "0": 0,
        "1": 3
      }
    }
  }
}
