{
  "fixture_version": "escopa-fixture/v1",
  "id": "scopas/initial-table/four-cards-without-scopa-partition",
  "ruleset": "escopa-2p-v1",
  "description": "A four-card opening table that does not total 15 and has no partition into two 15s is left on table.",
  "deck_type": "spanish",
  "initial_state": {
    "dealer": 0,
    "next_player": 0,
    "score": {
      "0": 0,
      "1": 0
    },
    "stock_remaining": 30,
    "hands": {
      "0": [
        { "id": "pn0p0", "rank": "Q", "suit": "OROS" },
        { "id": "pn0p1", "rank": "4", "suit": "COPAS" },
        { "id": "pn0p2", "rank": "A", "suit": "ESPADAS" }
      ],
      "1": [
        { "id": "pn1p0", "rank": "7", "suit": "COPAS" },
        { "id": "pn1p1", "rank": "6", "suit": "BASTOS" },
        { "id": "pn1p2", "rank": "K", "suit": "OROS" }
      ]
    },
    "captured": {
      "0": [],
      "1": []
    },
    "table": [
      { "id": "pn0t0", "rank": "A", "suit": "OROS" },
      { "id": "pn0t1", "rank": "2", "suit": "COPAS" },
      { "id": "pn0t2", "rank": "4", "suit": "ESPADAS" },
      { "id": "pn0t3", "rank": "K", "suit": "BASTOS" }
    ],
    "scopas": {
      "0": 0,
      "1": 0
    },
    "target_score": 15,
    "scoring_suit": "OROS"
  },
  "action": {
    "type": "resolve_initial_table"
  },
  "expected": {
    "state": {
      "dealer": 0,
      "next_player": 0,
      "score": {
        "0": 0,
        "1": 0
      },
      "stock_remaining": 30,
      "hands": {
        "0": [
          { "id": "pn0p0", "rank": "Q", "suit": "OROS" },
          { "id": "pn0p1", "rank": "4", "suit": "COPAS" },
          { "id": "pn0p2", "rank": "A", "suit": "ESPADAS" }
        ],
        "1": [
          { "id": "pn1p0", "rank": "7", "suit": "COPAS" },
          { "id": "pn1p1", "rank": "6", "suit": "BASTOS" },
          { "id": "pn1p2", "rank": "K", "suit": "OROS" }
        ]
      },
      "captured": {
        "0": [],
        "1": []
      },
      "table": [
        { "id": "pn0t0", "rank": "A", "suit": "OROS" },
        { "id": "pn0t1", "rank": "2", "suit": "COPAS" },
        { "id": "pn0t2", "rank": "4", "suit": "ESPADAS" },
        { "id": "pn0t3", "rank": "K", "suit": "BASTOS" }
      ],
      "scopas": {
        "0": 0,
        "1": 0
      },
      "target_score": 15,
      "scoring_suit": "OROS"
    }
  }
}
