{
  "fixture_version": "escopa-fixture/v1",
  "id": "scopas/normal-scopa/capture-clears-table",
  "ruleset": "escopa-2p-v1",
  "description": "A normal capture that empties table awards one scopa and clears the table.",
  "deck_type": "french",
  "initial_state": {
    "dealer": 1,
    "next_player": 1,
    "score": {
      "0": 0,
      "1": 0
    },
    "stock_remaining": 24,
    "hands": {
      "0": [
        { "id": "n0p0h0", "rank": "J", "suit": "DIAMONDS" },
        { "id": "n0p0h1", "rank": "A", "suit": "SPADES" },
        { "id": "n0p0h2", "rank": "3", "suit": "HEARTS" }
      ],
      "1": [
        { "id": "n0p1h0", "rank": "5", "suit": "CLUBS" },
        { "id": "n0p1h1", "rank": "6", "suit": "DIAMONDS" },
        { "id": "n0p1h2", "rank": "K", "suit": "SPADES" }
      ]
    },
    "captured": {
      "0": [],
      "1": []
    },
    "table": [
      { "id": "n0t0", "rank": "A", "suit": "DIAMONDS" },
      { "id": "n0t1", "rank": "2", "suit": "HEARTS" },
      { "id": "n0t2", "rank": "2", "suit": "SPADES" },
      { "id": "n0t3", "rank": "4", "suit": "CLUBS" }
    ],
    "scopas": {
      "0": 0,
      "1": 0
    },
    "target_score": 15,
    "scoring_suit": "DIAMONDS"
  },
  "action": {
    "type": "play_card",
    "player": 1,
    "card_id": "n0p1h1",
    "captured_card_ids": ["n0t0", "n0t1", "n0t2", "n0t3"]
  },
  "expected": {
    "state": {
      "dealer": 1,
      "next_player": 0,
      "score": {
        "0": 0,
        "1": 0
      },
      "stock_remaining": 24,
      "hands": {
        "0": [
          { "id": "n0p0h0", "rank": "J", "suit": "DIAMONDS" },
          { "id": "n0p0h1", "rank": "A", "suit": "SPADES" },
          { "id": "n0p0h2", "rank": "3", "suit": "HEARTS" }
        ],
        "1": [
          { "id": "n0p1h0", "rank": "5", "suit": "CLUBS" },
          { "id": "n0p1h2", "rank": "K", "suit": "SPADES" }
        ]
      },
      "captured": {
        "0": [],
        "1": [
          { "id": "n0p1h1", "rank": "6", "suit": "DIAMONDS" },
          { "id": "n0t0", "rank": "A", "suit": "DIAMONDS" },
          { "id": "n0t1", "rank": "2", "suit": "HEARTS" },
          { "id": "n0t2", "rank": "2", "suit": "SPADES" },
          { "id": "n0t3", "rank": "4", "suit": "CLUBS" }
        ]
      },
      "table": [],
      "scopas": {
        "0": 0,
        "1": 1
      },
      "target_score": 15,
      "scoring_suit": "DIAMONDS",
      "last_captor": 1
    }
  }
}
