{
  "fixture_version": "escopa-fixture/v1",
  "id": "captures/legal-capture/single-set",
  "ruleset": "escopa-2p-v1",
  "description": "Legal capture: played card plus exact table set summing to 15.",
  "deck_type": "spanish",
  "initial_state": {
    "dealer": 0,
    "next_player": 0,
    "score": {
      "0": 0,
      "1": 0
    },
    "stock_remaining": 29,
    "hands": {
      "0": [
        { "id": "s0p0h0", "rank": "Q", "suit": "OROS" },
        { "id": "s0p0h1", "rank": "4", "suit": "COPAS" },
        { "id": "s0p0h2", "rank": "2", "suit": "ESPADAS" }
      ],
      "1": [
        { "id": "s0p1h0", "rank": "7", "suit": "BASTOS" },
        { "id": "s0p1h1", "rank": "6", "suit": "OROS" },
        { "id": "s0p1h2", "rank": "A", "suit": "BASTOS" }
      ]
    },
    "captured": {
      "0": [],
      "1": []
    },
    "table": [
      { "id": "s0t0", "rank": "A", "suit": "COPAS" },
      { "id": "s0t1", "rank": "6", "suit": "BASTOS" },
      { "id": "s0t2", "rank": "2", "suit": "OROS" }
    ],
    "scopas": {
      "0": 0,
      "1": 0
    },
    "target_score": 15,
    "scoring_suit": "OROS"
  },
  "action": {
    "type": "play_card",
    "player": 0,
    "card_id": "s0p0h0",
    "captured_card_ids": [
      "s0t0",
      "s0t1"
    ]
  },
  "expected": {
    "state": {
      "dealer": 0,
      "next_player": 1,
      "score": {
        "0": 0,
        "1": 0
      },
      "stock_remaining": 29,
      "hands": {
        "0": [
          { "id": "s0p0h1", "rank": "4", "suit": "COPAS" },
          { "id": "s0p0h2", "rank": "2", "suit": "ESPADAS" }
        ],
        "1": [
          { "id": "s0p1h0", "rank": "7", "suit": "BASTOS" },
          { "id": "s0p1h1", "rank": "6", "suit": "OROS" },
          { "id": "s0p1h2", "rank": "A", "suit": "BASTOS" }
        ]
      },
      "captured": {
        "0": [
          { "id": "s0p0h0", "rank": "Q", "suit": "OROS" },
          { "id": "s0t0", "rank": "A", "suit": "COPAS" },
          { "id": "s0t1", "rank": "6", "suit": "BASTOS" }
        ],
        "1": []
      },
      "table": [
        { "id": "s0t2", "rank": "2", "suit": "OROS" }
      ],
      "scopas": {
        "0": 0,
        "1": 0
      },
      "target_score": 15,
      "scoring_suit": "OROS",
      "last_captor": 0
    }
  }
}
